{
  "provider_family": "dobby",
  "version": "5dfc8546954ce3b3198132ab13fddb89ee92cdd7+hookkit-publication-order-2026-08-11",
  "commit": "5dfc8546954ce3b3198132ab13fddb89ee92cdd7",
  "sha256": "b694e128c8f28b4b305e3241bff98f530c1815fc6e5837341a56b2847a1f37ad",
  "exported_abi": ["DobbyHook", "DobbyDestroy"],
  "architecture": "arm64e",
  "os_lane": "rootless",
  "load_path": "compiled_in:vendor/dobby/libdobby.a",
  "discovery_method": "compiled_in",
  "activation_behavior": {
    "requires_provider_activation": true,
    "requires_provider_image_load": false,
    "constructor_behavior": "unbounded_or_unknown",
    "thread_behavior": "none",
    "callback_behavior": "none",
    "executable_allocation_behavior": "dynamic"
  },
  "continuation_kind": "dynamic",
  "continuation_inspectable": true,
  "original_publication_order": "before_activation",
  "mutation_failure_semantics": "may_partially_mutate",
  "verification_capability": "self_reported_only",
  "device_test_results": [
    {
      "test_id": "hk3-provider-dobby-conformance",
      "verification_level": "host_verified",
      "result": "not_run"
    }
  ],
  "certification_status": "uncertified"
}
